index,Names,Gender,Count,Probability,quote,author,tags,likes
673,Maxwell,M,97478,0.000266772,"Being brave is when you have to do something because you know it is right, but at the same time, you are afraid to do it, because it might hurt or whatever. But you do it anyway.","Meg Cabot,",bravery;inspirational,815
674,Jenny,F,97194,0.000265995,"Anger is like flowing water; there's nothing wrong with it as long as you let it flow. Hate is like stagnant water; anger that you denied yourself the freedom to feel, the freedom to flow; water that you gathered in one place and left to forget. Stagnant water becomes dirty, stinky, disease-ridden, poisonous, deadly; that is your hate. On flowing water travels little paper boats; paper boats of forgiveness. Allow yourself to feel anger, allow your waters to flow, along with all the paper boats of forgiveness. Be human.",C. JoyBell C.,anger;forgiveness;hate;human;humanism;humanity;inspirational;inspirational-attitude;inspirational-life;inspirational-quotes;inspiring;water,813
675,Micah,M,97194,0.000265995,"Life is a process of becoming, a combination of states we have to go through. Where people fail is that they wish to elect a state and remain in it. This is a kind of death.",ANAIS NIN,inspirational,813
676,Isabelle,F,96894,0.000265174,"My task, which I am trying to achieve is, by the power of the written word, to make you hear, to make you feel--it is, before all, to make you see.","Joseph Conrad,",inspirational;power-of-words;writing,811
677,Ada,F,96829,0.000264996,"I want to live my life in such a way that when I get out of bed in the morning, the devil says, ""aw shit, he's up!","Steve Maraboli,",aspirations;devil;goodness;inspirational;life;live;morning;motivational;purpose,811
678,Briana,F,95885,0.000262412,You save yourself or you remain unsaved.,Alice Sebold,inspirational;rape;self-responsibility,811
679,Tanner,M,95697,0.000261898,"Not knowing you can't do something, is sometimes all it takes to do it.",Ally Carter,ally;carter;gallagher;girls;inspirational,807
680,Marguerite,F,94926,0.000259788,This life is yours. Take the power to choose what you want to do and do it well. Take the power to love what you want in life and love it honestly. Take the power to walk in the forest and be a part of nature. Take the power to control your own life. No one else can do it for you. Take the power to make your life happy.,Susan Polis Schutz,forest;happiness;honesty;inspirational;life;love;nature;power,805
681,Jamie,M,94887,0.000259681,"I'll think of it tomorrow, at Tara. I can stand it then. Tomorrow, I'll think of some way to get him back. After all, tomorrow is another day.","Margaret Mitchell,",inspirational;procrastination,804
682,Lonnie,M,94795,0.000259429,"But still, I find the need to remind myself of the temporariness of a day, to reassure myself that I got through yesterday, I'll get through today.","Gayle Forman ,",inspirational;where-she-went,800
683,Angelica,F,94247,0.00025793,"No life is a waste,"" the Blue Man said. ""The only time we waste is the time we spend thinking we're alone.",Mitch Albom,connectedness;inspirational;interdependence,799
684,Marshall,M,94138,0.000257631,You're never given a dream without also being given the power to make it true.,"Richard Bach,",dreams;inspirational,798
685,Bridget,F,94104,0.000257538,Music is the literature of the heart; it commences where speech ends.,Alphonse de Lamartine,expression;heart;inspirational;music;power-of-music,795
686,Tracey,F,93256,0.000255217,"Write it. Shoot it. Publish it. Crochet it, saut?? it, whatever. MAKE.",Joss Whedon,action;creating;humor;inspirational,794
687,Bob,M,93084,0.000254747,Live today. Not yesterday. Not tomorrow. Just today. Inhabit your moments. Don??t rent them out to tomorrow. Do you know what you??re doing when you spend a moment wondering how things are going to turn out with Perry,"Jerry Spinelli,",inspirational;live-in-the-moment;today,786
688,Abraham,M,93050,0.000254654,"Believe nothing, no matter where you read it, or who said it, no matter if I have said it, unless it agrees with your own reason and your own common sense.",Buddha Siddhartha Guatama Shakyamuni,buddhist;inspirational,779
689,Arianna,F,92862,0.000254139,A smart person knows how to talk. A wise person knows when to be silent.,Roy T. Bennett,inspiration;inspirational;inspirational-quotes;inspire;inspiring;keep-silent;life;life-quotes;living;optimism;optimistic;positive;positive-affirmation;positive-life;positive-thinking;silent;talk;wisdom,765
690,Madelyn,F,92656,0.000253575,"In friendship...we think we have chosen our peers. In reality a few years' difference in the dates of our births, a few more miles between certain houses, the choice of one university instead of another...the accident of a topic being raised or not raised at a first meeting--any of these chances might have kept us apart. But, for a Christian, there are, strictly speaking no chances. A secret master of ceremonies has been at work. Christ, who said to the disciples, ""Ye have not chosen me, but I have chosen you,"" can truly say to every group of Christian friends, ""Ye have not chosen one another but I have chosen you for one another."" The friendship is not a reward for our discriminating and good taste in finding one another out. It is the instrument by which God reveals to each of us the beauties of others.","C.S. Lewis,",friendship;inspirational,1218
691,Adriana,F,92615,0.000253463,"In the long run, the sharpest weapon of all is a kind and gentle spirit.","Anne Frank,",inspirational,1163
692,Andy,M,92381,0.000252823,Only he who attempts the absurd is capable of achieving the impossible.,Miguel de Unamuno,inspirational;motivational,854
693,Brady,M,92316,0.000252645,"The place to improve the world is first in one's own heart and head and hands, and then work outward from there.","Robert M. Pirsig,",inspirational,840
694,Guy,M,92254,0.000252475,"So many people live within unhappy circumstances and yet will not take the initiative to change their situation because they are conditioned to a life of security, conformity, and conservatism, all of which may appear to give one peace of mind, but in reality nothing is more dangerous to the adventurous spirit within a man than a secure future. The very basic core of a man??s living spirit is his passion for adventure. The joy of life comes from our encounters with new experiences, and hence there is no greater joy than to have an endlessly changing horizon, for each day to have a new and different sun.","Jon Krakauer,",change;complacency;inspirational,826
695,Nicolas,M,92222,0.000252388,"Amor Fati ?? ??Love Your Fate??, which is in fact your life.",Friedrich Nietzsche,fate;inspirational;life;love,821
696,Jackie,F,92216,0.000252371,"What you are is God's gift to you, what you become is your gift to God.","Hans Urs von Balthasar,",catholicism;christian-living;christianity;gift;god;inspirational;philosophy;spirituality,820
697,Candace,F,91780,0.000251178,"You are not the victim of the world, but rather the master of your own destiny. It is your choices and decisions that determine your destiny.",Roy T. Bennett,choice;choices;decision;decisions;destiny;inspiration;inspirational;inspirational-quotes;inspire;inspiring;life;life-quotes;living,818
698,Hope,F,91732,0.000251047,There's nothing wrong with you. There's a lot wrong with the world you live in. And definitely get out of high school and make everyone sorry.,Chris Colfer,inspirational,806
699,Karla,F,91688,0.000250926,When I was growing up I always wanted to be someone. Now I realize I should have been more specific.,Lily Tomlin,funny;goals-in-life;humor;inspirational;wish,800
700,Claude,M,91595,0.000250672,"Fear doesn't shut you down; it wakes you up. I've seen it. It's fascinating."" He releases me but doesn't pull away, his hand grazing my jaw, my neck. ""Sometimes I just...want to see it again. Want to see you awake.","Veronica Roth,",inspirational;love,797
701,Pedro,M,91246,0.000249717,Let me never fall into the vulgar mistake of dreaming that I am persecuted whenever I am contradicted.,"Ralph Waldo Emerson,",contradiction;correcting;correction;criticism;inspirational;opinions;paranoia,786
702,Jillian,F,90999,0.000249041,"If you start by promising what you don't even have yet, you'll lose your desire to work towards getting it.","Paulo Coelho,",inspirational;motivation,779
703,Brittney,F,90902,0.000248775,"Bitch (noun): A woman who won't bang her head against the wall obsessing over someone else's opinion - be it a man or anyone else in her life. She understands that if someone does not approve of her, it's just one person's opinion; therefore, it's of no real importance. She doesn't try to live up to anyone else's standards - only her own. Because of this, she relates to a man very differently.","Sherry Argov,",inspirational,778
704,Rachael,F,90117,0.000246627,"Adapt what is useful, reject what is useless, and add what is specifically your own.",Bruce Lee,advice;bruce-lee;inspirational,777
705,Damian,M,89886,0.000245995,"Where your treasure is, there will your heart be also.","Anonymous,",harry-potter;heart;inspirational;treasure,775
706,Lola,F,89480,0.000244884,"There are two kinds of teachers: the kind that fill you with so much quail shot that you can't move, and the kind that just gives you a little prod behind and you jump to the skies.",Robert Frost,inspirational;teachers,773
707,Ross,M,89424,0.00024473,"Life moves on, whether we act as cowards or heroes. Life has no other discipline to impose, if we would but realize it, than to accept life unquestioningly. Everything we shut our eyes to, everything we run away from, everything we deny, denigrate or despise, serves to defeat us in the end. What seems nasty, painful, evil, can become a source of beauty, joy, and strength, if faced with an open mind. Every moment is a golden one for him who has the vision to recognize it as such",Henry Miller,inspirational,771
708,Kate,F,89413,0.0002447,Weekends don't count unless you spend them doing something completely pointless.,Bill Watterson,inspirational;recreation,770
709,Layla,F,89391,0.00024464,"The fishermen know that the sea is dangerous and the storm terrible, but they have never found these dangers sufficient reason for remaining ashore.",Vincent Van Gogh,inspirational,767
710,Jade,F,89382,0.000244615,"I am seeking, I am striving, I am in it with all my heart.",Vincent van Gogh,inspirational,767
711,Harriet,F,89325,0.000244459,LAW ,"Robert Greene,",inspirational;motivational,766
712,Bobbie,F,89318,0.00024444,Well done is better than well said.,Benjamin Franklin,inspirational,764
713,Misty,F,89311,0.000244421,"If you don??t give up on something you truly believe in, you will find a way.",Roy T. Bennett,believe;believe-in-yourself;don-t-give-up;inspiration;inspirational;inspirational-quotes;inspire;inspiring;life;life-quotes;living;motivation;motivational;never-give-up;optimism;optimistic;positive;positive-affirmation;positive-life;positive-thinking,764
714,Cooper,M,89027,0.000243644,The most important decision you make is to be in a good mood.,Voltaire,inspirational,761
715,Kurt,M,88970,0.000243488,The strength of a woman is not measured by the impact that all her hardships in life have had on her; but the strength of a woman is measured by the extent of her refusal to allow those hardships to dictate her and who she becomes.,C. JoyBell C.,inspirational;inspirational-life;the-strength-of-a-woman;true-strength;wisdom-quotes;women;women-s-inspirational;women-s-strength,755
716,Kristine,F,88757,0.000242905,"Get up, stand up, Stand up for your rights. Get up, stand up, Don't give up the fight.","Bob Marley,",activism;inspirational;protest;song-lyrics,731
717,Aaliyah,F,88543,0.000242319,"He is free to evade reality, he is free to unfocus his mind and stumble blindly down any road he pleases, but not free to avoid the abyss he refuses to see.",Ayn Rand,inspirational,731
718,Geneva,F,88234,0.000241474,"When you hold a grudge, you want someone else??s sorrow to reflect your level of hurt but the two rarely meet.","Steve Maraboli,",grudges;hurt;inspirational;life;relationships;sorry,725
719,Desiree,F,88026,0.000240904,"Focus on your goals, not your fear","Roy T. Bennett,",authentic-living;being-positive;fearless;focus;goals;inspiration;inspirational;inspirational-quotes;life;life-quotes;motivation;optimism;optimistic;positive;positive-affirmation;positive-life;positive-thinking,601
720,Dakota,M,87942,0.000240674,"I am a happy camper so I guess I??m doing something right. Happiness is like a butterfly; the more you chase it, the more it will elude you, but if you turn your attention to other things, it will come and sit softly on your shoulder.",J. Richard Lessor,happiness;inspirational,861
721,Shelly,F,87866,0.000240466,Though the road's been rocky it sure feels good to me.,Bob Marley,inspirational;journey;life,844
722,Becky,F,87810,0.000240313,"To be rejected by someone doesn't mean you should also reject yourself or that you should think of yourself as a lesser person. It doesn't mean that nobody will ever love you anymore. Remember that only ONE person has rejected you at the moment, and it only hurt so much because to you, that person's opinion symbolized the opinion of the whole world, of God.","Jocelyn Soriano,",breakup;broken;broken-heart;broken-hearted;broken-hearted-quotes;dating;faith;healing;heartache;heartbreak;heartbroken;hope;hurt;hurt-feelings;hurting;hurting-heart;inspirational;life;life-lessons;love;romance,793
723,Jacquelyn,F,87663,0.000239911,"Anything that??s human is mentionable, and anything that is mentionable can be more manageable. When we can talk about our feelings, they become less overwhelming, less upsetting, and less scary. The people we trust with that important talk can help us know that we are not alone.",Fred Rogers,communication;fear;friendship;inspirational;trauma;trust,787
724,Kelly,M,87633,0.000239829,A Woman in harmony with her spiri,Maya Angelou,inspirational,767
725,Blanche,F,87556,0.000239618,"The three great essentials to achieve anything worthwhile are, first, hard work; second, stick-to-itiveness; third, common sense.",Thomas A. Edison,common-sense;enterprise;hard-work;inspirational;perseverance;persistence;success;thomas-edison,760
726,Velma,F,87147,0.000238499,"That which God said to the rose, and caused it to laugh in full-blown beauty, He said to my heart, and made it a hundred times more beautiful.",Rumi,inspirational;love;spiritual,759
727,Krystal,F,87003,0.000238105,It??s dark because you are trying too hard,"Aldous Huxley ,",inspirational,752
728,Raul,M,86851,0.000237689,"Even if things don't unfold the way you expected, don't be disheartened or give up. One who continues to advance will win in the end.",Daisaku Ikeda,buddhism;destiny;happiness;humanism;inspirational;karma;peace;self-reformation,745
729,Brad,M,86052,0.000235502,To live is so startling it leaves little time for anything else.,Emily Dickinson,inspirational,737
730,Ben,M,86040,0.000235469,"No man chooses evil because it is evil; he only mistakes it for happiness, the good he seeks.",Mary Shelley,inspirational,733
731,Sherri,F,86032,0.000235447,"I do not believe in taking the right decision, I take a decision and make it right.",Muhammad Ali Jinnah,inspirational;positive-attitude;self-awareness;self-confidence;self-improvement,732
732,Andres,M,85981,0.000235308,Be the positive impact on the lives of others.,Roy T. Bennett,inspiration;inspirational;inspirational-quotes;inspire;inspiring;life;life-quotes;living;motivation;motivational;optimism;optimistic;positive;positive-affirmation;positive-life;positive-thinking,728
733,Susie,F,85484,0.000233948,"Keep your eyes on the stars, and your feet on the ground.",Theodore Roosevelt,inspirational,725
734,Fannie,F,85120,0.000232951,I remembered the fox. One runs the risk of crying a bit if one allows oneself to be tamed.,"Antoine de Saint-Exup??ry,",inspirational,722
735,Sidney,M,85101,0.000232899,"Difficulties strengthen the mind, as labor does the body.",Lucius Annaeus Seneca,adversity;challenges;character;inspirational,721
736,Zoey,F,85044,0.000232743,Do not worry about your difficulties in Mathematics. I can assure you mine are still greater.,Albert Einstein,inspirational,717
737,Miles,M,84949,0.000232483,"It's not about how to achieve your dreams, it's about how to lead your life, ... If you lead your life the right way, the karma will take care of itself, the dreams will come to you.","Randy Pausch,",childhood-dream;inspirational,714
738,Breanna,F,84827,0.00023215,"Start by doing what is necessary, then what is possible, and suddenly you are doing the impossible.",St. Francis Of Assisi,inspirational,708
739,Monique,F,84784,0.000232032,"I??m bored?? is a useless thing to say. I mean, you live in a great, big, vast world that you??ve seen none percent of. Even the inside of your own mind is endless; it goes on forever, inwardly, do you understand? The fact that you??re alive is amazing, so you don??t get to say ??I??m bored.",Louis C.K.,advice;bored;boredom;inspirational;reprimand;young,707
740,Hugh,M,84741,0.000231914,"Wasn't that the point of the book? For women to realize, We are just two people. Not that much separates us. Not nearly as much as I'd thought.","Kathryn Stockett,",equality;inspirational;race;women,706
741,Lula,F,84501,0.000231257,Don't confuse poor decision-making with destiny. Own your mistakes. It??s ok; we all make them. Learn from them so they can empower you!,"Steve Maraboli,",action;change;destiny;empowerment;inspirational;life;mistakes;motivational;success,706
742,Iris,F,84446,0.000231107,Surround yourself only with people who are going to take you higher.,Oprah Winfrey,inspirational,702
743,Mathew,M,84012,0.000229919,The place where you made your stand never mattered. Only that you were there...and still on your feet.,"Stephen King,",inspirational,701
744,Byron,M,83912,0.000229645,I just hope I remember to tell my kids that they are as happy as I look in my old photographs. And I hope that they believe me.,"Stephen Chbosky,",inspirational,699
745,Jodi,F,83676,0.000229,"We've all started to put down the virtues of the other factions in the process of bolstering our own. I don't want to do that. I want to be brave, and selfless, and smart, and kind, and honest."" He clears his throat. ""I continually struggle with kindness.","Veronica Roth,",four;inspirational;tobias;tris,692
746,Casey,F,83604,0.000228802,Sometimes I think my head is so big because it is so full of dreams,"R.J. Palacio,",dreams;inspirational,687
747,Tim,M,83483,0.000228471,"You can't become a decent horseman until you fall off and get up again, a good number of times","Bear Grylls,",falling;horse;inspirational;life;living;never-giving-up,687
748,Elias,M,83144,0.000227544,"Integrity is doing the right thing when nobody's watching, and doing as you say you would do.","Roy T. Bennett,",inspiration;inspirational;inspirational-attitude;inspirational-life;inspirational-quotes;inspire;inspiring;integrity;life;life-and-living;life-lessons;life-quotes;living;optimism;optimistic;positive,634
749,Rick,M,82883,0.000226829,Discipline Your Mind to Think Positively: Discipline your mind to see the good in every situation and look on the best side of every event.,"Roy T. Bennett,",inspiration;inspirational;inspirational-attitude;inspirational-life;inspirational-quotes;inspire;inspiring;life;life-and-living;life-lessons;life-quotes;living;motivation;motivational;optimism;optimistic;positive;positive-affirmation;positive-life;positive-thinking,613
750,Wallace,M,82688,0.000226296,You may choose to look the other way but you can never say again that you did not know.,William Wilberforce,abolition;accomplish;christian;great-britain;heard;hope;inspirational;love;peace;slavery;truth;try,858
751,Harper,F,82459,0.000225669,"I'm not saying I'm gonna change the world, but I guarantee that I will spark the brain that will change the world.",Tupac Shakur,hiphop;inspirational;music,824
752,Summer,F,82316,0.000225278,How would your life be different if??You stopped allowing other people to dilute or poison your day with their words or opinions? Let today be the day??You stand strong in the truth of your beauty and journey through your day without attachment to the validation of others,"Steve Maraboli,",choices;inspirational;life;motivational;opinions;self-empowerment;self-esteem;self-love,815
753,Grayson,M,82241,0.000225072,To the world you may be one person but to one person you may be the world.,Bill Wilson,devotion;inspirational;love,776
754,Dalton,M,82235,0.000225056,The stupid neither forgive nor forget; the naive forgive and forget; the wise forgive but do not forget.,Thomas Szasz,forgiveness;inspirational;naivety;wisdom,756
755,Lynda,F,81995,0.000224399,do not look for healin,"Rupi Kaur,",abuse-survivors;healing;inspirational;poetry,744
756,Harrison,M,81847,0.000223994,Turn your obstacles into opportunities and your problems into possibilities.,"Roy T. Bennett,",inspiration;inspirational;inspirational-attitude;inspirational-life;inspirational-quotes;inspire;inspiring;life;life-and-living;life-lessons;life-quotes;living;motivation;motivational;obstacle;opportunity;optimism;optimistic;positive;positive-affirmation;positive-life;positive-thinking;possibility;problem,742
757,Krista,F,81838,0.000223969,"I began to realize how important it was to be an enthusiast in life. He taught me that if you are interested in something, no matter what it is, go at it at full speed ahead. Embrace it with both arms, hug it, love it and above all become passionate about it. Lukewarm is no good. Hot is no good either. White hot and passionate is the only thing to be.","Roald Dahl,",enthusiasm;inspirational;passion;passionate-living,736
758,Hilda,F,81765,0.00022377,"Real magic can never be made by offering someone else's liver. You must tear out your own, and not expect to get it back.","Peter S. Beagle,",inspirational;magic;reminding;sacrifice,734
759,Tyrone,M,81702,0.000223597,"One of the most spiritual things you can do is embrace your humanity. Connect with those around you today. Say, ""I love you"", ""I'm sorry"", ""I appreciate you"", ""I'm proud of you""...whatever you're feeling. Send random texts, write a cute note, embrace your truth and share it...cause a smile today for someone else...and give plenty of hugs.",Steve Maraboli,action;compassion;humanity;inspirational;kindness;life;living-now;motivational;seize-the-day;spirituality;success,733
760,Jaxon,M,81613,0.000223354,Remember tonight... for it is the beginning of always,Dante,beginnings;inspirational;memory,727
761,Rafael,M,81463,0.000222943,My happiness is not the means to any end. It is the end. It is its own goal. It is its own purpose.,"Ayn Rand,",happiness;inspirational;salvation,716
762,Gabriela,F,81173,0.000222149,It [feminism] is mixed up with a muddled idea that women are free when they serve their employers but slaves when they help their husbands.,G.K. Chesterton,femininism;inspirational;lies,697
763,Nevaeh,F,80996,0.000221665,"It's worth making time to find the things that really stir your soul. That??s what makes you really feel alive. You have to say ??no?? to other things you??re used to, and do it with all your heart.",Roy T. Bennett,awareness;heart;inspiration;inspirational;inspirational-quotes;inspire;inspiring;life;life-quotes;living;optimism;optimistic;positive;positive-affirmation;positive-life;positive-thinking;soul;soul-and-heart;stir-your-soul;time,694
764,Sheryl,F,80956,0.000221556,Dreams don't work unless you take action. The surest way to make your dreams come true is to live them.,Roy T. Bennett,action;do;dream;dream-comes-true;dreams;dreams-come-true;dreams-quotes;inspiration;inspirational;inspirational-quotes;inspire;inspiring;life;life-quotes;living;living-life;motivational;motivational-inspirational;positive-affirmation;positive-life;positive-thinking;positivity;take-action;take-actions,690
765,Drew,M,80854,0.000221276,"Go and make interesting mistakes, make amazing mistakes, make glorious and fantastic mistakes. Break rules. Leave the world more interesting for your being here.","Neil Gaiman,",inspirational,688
766,Kristi,F,80833,0.000221219,"No, this is not the beginning of a new chapter in my life; this is the beginning of a new book! That first book is already closed, ended, and tossed into the seas; this new book is newly opened, has just begun! Look, it is the first page! And it is a beautiful one!",C. JoyBell C.,a-beautiful-beginning;a-new-beginning;endings;endings-and-beginnings;inspirational;inspirational-life;inspirational-quotes;new-beginnings;the-end,686
767,Rosie,F,80792,0.000221107,"We are saved by faith alone, but the faith that saves is never alone.",Martin Luther,christianity;faith;inspirational;religion,683
768,Elena,F,80752,0.000220997,The duty of youth is to challenge corruption.,Kurt Cobain,activism;dissent;inspirational;protest;truth-telling,680
769,Angelo,M,80565,0.000220486,There is no passion to be found playing small - in settling for a life that is less than the one you are capable of living.,Nelson Mandela,inspirational,678
770,Eunice,F,80318,0.00021981,What is now proved was once only imagined.,William Blake,english-poet;inspirational;knowledge;willpower,677
771,Shelley,F,80212,0.000219519,"I don't paint dreams or nightmares, I paint my own reality.",Frida Kahlo,art;dreams;inspirational;nightmares;painting,677
772,Nelson,M,80165,0.000219391,"Feet, what do I need them fo",Frida Kahlo,inspirational,668
773,Antoinette,F,79851,0.000218531,Envy is ignorance,"Ralph Waldo Emerson,",inspirational,665
774,Dwayne,M,79640,0.000217954,Being happy doesn't mean that everything is perfect. It means that you've decided to look beyond the imperfections.,Gerard Way,inspirational;life,662
