index,Names,Gender,Count,Probability,quote,author,tags,likes
396,Lynn,F,186861,0.00051139,"You only need one man to love you. But him to love you free like a wildfire, crazy like the moon, always like tomorrow, sudden like an inhale and overcoming like the tides. Only one man and all of this.",C. JoyBell C.,inspirational;inspirational-love;inspiring;love;men;passion;real-love;the-love-of-a-man;true-love,1688
397,Blake,M,186538,0.000510506,You'll never find a rainbow if you're looking down,Charlie Chaplin,inspirational;optimism;pessimism;wonder,1681
398,Dean,M,185933,0.00050885,"There is some kind of a sweet innocence in being human- in not having to be just happy or just sad- in the nature of being able to be both broken and whole, at the same time.",C. JoyBell C.,being-human;happiness;human;human-nature;humanism;humanity;inspirational;inspirational-quotes;inspiring;life;life-and-living;living;sadness,1680
399,Kim,F,185421,0.000507449,"Everybody is special. Everybody. Everybody is a hero, a lover, a fool, a villain. Everybody. Everybody has their story to tell.","Alan Moore,",favourite-quote;inspirational,1673
400,Bernice,F,184172,0.000504031,"The only person who can pull me down is myself, and I'm not going to let myself pull me down anymore.",C. JoyBell C.,belief-in-self;believe-in-yourself;inspiration;inspirational;inspirational-attitude;inspirational-life;life;living;self-awareness;self-belief;self-knowledge;self-love,1650
401,Ronnie,M,184017,0.000503607,"Life sucks, and then you die...","Stephenie Meyer,",humor;inspirational,1645
402,Warren,M,182931,0.000500635,"Always remember people who have helped you along the way, and don??t forget to lift someone up.","Roy T. Bennett,",gratitude;inspiration;inspirational;inspirational-attitude;inspirational-life;inspirational-quotes;inspire;inspiring;leader;leadership;life;life-and-living;life-lessons;life-quotes;living;motivation;motivational;optimism;optimistic;positive;positive-affirmation;positive-life;positive-thinking,1637
403,Gavin,M,182621,0.000499786,"Excellence is never an accident. It is always the result of high intention, sincere effort, and intelligent execution; it represents the wise choice of many alternatives - choice, not chance, determines your destiny.",Aristotle,choice;inspirational,1626
404,Miguel,M,182423,0.000499244,The biggest adventure you can ever take is to live the life of your dreams.,Oprah Winfrey,adventure;bravery;inspirational;life,1621
405,Cassandra,F,182385,0.00049914,Wanting to be someone else is a waste of who you are,Kurt Cobain,individuality;inspirational;misattributed;self-acceptance,1606
406,Regina,F,181248,0.000496029,"People where you live,"" the little prince said, ""grow five thousand roses in one garden... yet they don't find what they're looking for..","Antoine de Saint-Exup??ry,",inspirational,1605
407,Elsie,F,181180,0.000495843,I never want to change so much that people can't recognize me.,Taylor Swift,inspirational,1600
408,Jo,F,179479,0.000491187,"There is nothing more rare, nor more beautiful, than a woman being unapologetically herself; comfortable in her perfect imperfection. To me, that is the true essence of beauty.","Steve Maraboli,",be-yourself;beauty;body-image;comfortable;happiness;imperfection;inspirational;life;rare;success;women,1587
409,Tommy,M,178878,0.000489543,I never saw a wild thing sorry for itself,D.H. Lawrence,inspirational,1582
410,Trevor,M,178869,0.000489518,"There is the great lesson of 'Beauty and the Beast,' that a thing must be loved before it is lovable.","Chesterton, G. K. (Gilbert Keith)",fairy-tales;inspirational,1576
411,Stella,F,177832,0.00048668,"Above all else, guard your heart for it affects everything else you do.","Anonymous,",bible;god;inspirational;religion,1572
412,Gertrude,F,177762,0.000486489,"Every day, think as you wake up, today I am fortunate to be alive, I have a precious human life, I am not going to waste it. I am going to use all my energies to develop myself, to expand my heart out to others; to achieve enlightenment for the benefit of all beings. I am going to have kind thoughts towards others, I am not going to get angry or think badly about others. I am going to benefit others as much as I can.",The Dalai Lama,inspirational,1567
413,Loretta,F,177476,0.000485706,The best things in life make you sweaty.,Edgar Allan Poe,inspirational;life;love;meaning-of-life;philosophical;puberty;purpose,1563
414,Rosa,F,176857,0.000484012,I live my life in widening circles that reach out across the world.,"Rainer Maria Rilke,",inspirational;life,1556
415,Sydney,F,175709,0.00048087,Be empty of worrying,"Mawlana Jalal-al-Din Rumi,",inspirational,1551
416,Oliver,M,175652,0.000480714,A man with outward courage dares to die; a man with inner courage dares to live.,"Lao Tzu,",courage;death;inspirational;life;moral-courage;real-life,1549
417,Chelsea,F,175569,0.000480487,A Penny Saved is a Penny Earned,Benjamin Franklin,funny;inspirational;money,1549
418,Roberta,F,175400,0.000480024,Death is not the greatest loss in life. The greatest loss is what dies inside while still alive. Never surrender.,Tupac Shakur,inspirational,1543
419,Savannah,F,175341,0.000479863,"We are going to die, and that makes us the lucky ones. Most people are never going to die because they are never going to be born. The potential people who could have been here in my place but who will in fact never see the light of day outnumber the sand grains of Arabia. Certainly those unborn ghosts include greater poets than Keats, scientists greater than Newton. We know this because the set of possible people allowed by our DNA so massively exceeds the set of actual people. In the teeth of these stupefying odds it is you and I, in our ordinariness, that are here.We privileged few, who won the lottery of birth against all odds, how dare we whine at our inevitable return to that prior state from which the vast majority have never stirred?","Richard Dawkins,",death;inspirational;science;wonder,1532
420,Lindsey,F,174517,0.000477608,"I think that we are like stars. Something happens to burst us open; but when we burst open and think we are dying; we??re actually turning into a supernova. And then when we look at ourselves again, we see that we??re suddenly more beautiful than we ever were before!",C. JoyBell C.,human;humanity;inspirational;inspirational-life;inspirational-quotes;inspiring;life;life-and-living;living;people;self-awareness;stars;strength;supernova;truth,1602
421,Brett,M,174463,0.00047746,"Travel far enough, you meet yourself.","David Mitchell,",inspirational;travel,1587
422,Colleen,F,174269,0.000476929,"If a man is called to be a street sweeper, he should sweep streets even as a Michaelangelo painted, or Beethoven composed music or Shakespeare wrote poetry. He should sweep streets so well that all the hosts of heaven and earth will pause to say, 'Here lived a great street sweeper who did his job well.",Martin Luther King Jr.,excellence;inspirational,1541
423,Gordon,M,174239,0.000476847,"Do not seek the because - in love there is no because, no reason, no explanation, no solutions.","Ana??s Nin,",inspirational;understanding,1540
424,Mitchell,M,174201,0.000476743,"When you arise in the morning think of what a privilege it is to be alive, to think, to enjoy, to love ...","Marcus Aurelius,",carpe-diem;inspirational;life;seize-the-day,1523
425,Charlie,M,173668,0.000475284,"I said to my soul, be still and wait without hope, for hope would be hope for the wrong thing; wait without love, for love would be love of the wrong thing; there is yet faith, but the faith and the love are all in the waiting. Wait without thought, for you are not ready for thought: So the darkness shall be the light, and the stillness the dancing.",T.S. Eliot,inspirational;meditation,1514
426,Dominic,M,173576,0.000475033,Make the most of yourself....for that is all there is of you.,Ralph Waldo Emerson,be-yourself;inspirational;self-improvement,1511
427,Jessie,F,172923,0.000473245,"It's okay,?? he said. ??We're together.?? He didn't sa","Rick Riordan,",absence;annabeth-chase;heroes-of-olympus;inspirational;love;percy-jackson;percy-jackson-and-the-olympians;relationship;separation;the-mark-of-athena,1511
428,Annette,F,172768,0.000472821,Believe you can and you're halfway there.,Theodore Roosevelt,courage;inspirational;self-confidence,1509
429,Molly,F,172555,0.000472238,Many of life's failures are people who did not realize how close they were to success when they gave up.,Thomas A. Edison,inspirational;perseverance;tenacity,1500
430,Cathy,F,172127,0.000471067,"Life is made of so many moments that mean nothing. Then one day, a single moment comes along to define every second that comes after. Such moments are tests of courage, of strength.","Sabaa Tahir,",courage;inspirational;strength,1499
431,Stacy,F,171498,0.000469346,"Maturity is when you stop complaining and making excuses, and start making changes.","Roy T. Bennett,",change;choice;choices;excuse;inspiration;inspirational;inspirational-attitude;inspirational-life;inspirational-quotes;inspire;inspiring;life;life-and-living;life-lessons;life-quotes;living;motivation;motivational;optimism;optimistic;positive;positive-affirmation;positive-life;positive-thinking,1482
432,Laurie,F,171426,0.000469149,In the end you should always do the right thing even if it's hard.,"Nicholas Sparks,",character;inspirational;integrity;nobility,1482
433,Lydia,F,171350,0.000468941,Life before Death,"Brandon Sanderson,",inspirational;motto,1482
434,Jon,M,170459,0.000466502,Aim higher in case you fall short.,"Suzanne Collins,",aspirations;goals;inspirational,1481
435,Chase,M,170437,0.000466442,???? ???? ??????...???? ??...???? ????..???? ??????...???? ?????...???? ???? ???? ?????? ????..?? ????? ?? ??? ??? ????? ?? ???? ??? ????? ???? ??????? ,"????? ?????,",inspirational,1479
436,Leon,M,170355,0.000466217,"Swords can win territories but not hearts, forces can bend heads but not minds.",Mirza Tahir Ahmad,ahmadiyya;inspirational,1478
437,Bessie,F,170345,0.00046619,"The damage was permanent; there would always be scars. But even the angriest scars faded over time until it was difficult to see them written on the skin at all, and the only thing that remained was the memory of how painful it had been.",Jodi Picoult,inspirational;love;pain,1455
438,Seth,M,170132,0.000465607,"Around here, however, we don't look backwards for very long. We keep moving forward, opening up new doors and doing new things, because we're curious...and curiosity keeps leading us down new paths.",Walt Disney Company,creativity;curiosity;inspirational,1455
439,Kaitlyn,F,170008,0.000465268,"We are products of our past, but we don't have to be prisoners of it.","Rick Warren,",change;growth;inspirational;learning-from-mistakes;past,1446
440,Don,M,168373,0.000460793,"When the going gets tough, put one foot in front of the other and just keep going. Don??t give up.","Roy T. Bennett,",adversity;challenge;inspiration;inspirational;inspirational-attitude;inspirational-life;inspirational-quotes;inspire;inspiring;keep-going;life;life-and-living;life-lessons;life-quotes;living;motivation;motivational;never-give-up;optimism;optimistic;persistence;positive;positive-affirmation;positive-life;positive-thinking,1437
441,Naomi,F,167842,0.00045934,Do not go gentle into that good night,"Dylan Thomas,",death-and-dying;inspirational;philosophy;poetry,1433
442,Jeanette,F,167796,0.000459214,The greatest thing in the world is to know how to belong to oneself.,"Michel de Montaigne,",ataraxy;independence;individuality;inspirational;self-assurance;self-awareness;self-containment;self-determination;self-esteem;self-reliance;self-respect;self-sufficiency;self-trust;solitude,1432
443,Hailey,F,166397,0.000455385,One Choic,"Veronica Roth,",inspirational;life,1431
444,Jeanne,F,164331,0.000449731,Dumbledore will only leave from Hogwarts when there are none loyal to him!,"J.K. Rowling,",inspirational,1431
445,Darrell,M,164242,0.000449488,"I like nonsense, it wakes up the brain cells. Fantasy is a necessary ingredient in living, It's a way of looking at life through the wrong end of a telescope. Which is what I do, And that enables you to laugh at life's realities.",Dr. Seuss,cat-in-the-hat;fantasy;inspirational,1423
446,Lloyd,M,164089,0.000449069,I may not always be with yo,"Marc Wambolt,",family;friendship;inspirational;love;poetry;relationships,1412
447,Carter,M,163758,0.000448163,"Go placidly amid the noise and the haste, and remember what peace there may be in silence. As far as possible without surrender, be on good terms with all persons. Speak your truth quietly and clearly, and listen to others, even the dull and ignorant; they too have their story. Be yourself. Especially do not feign affection. Neither be cynical about love ?? for in the face of all aridity and disenchantment it is perennial as the grass. Take kindly the counsel of the years, gracefully surrendering the things of youth. Nurture strength of spirit to shield you from misfortune. But do not distress yourself with imaginings. Many fears are born of fatigue and loneliness. Beyond a wholesome discipline, be gentle with yourself. You are a child of the universe no less than the trees and the stars; you have a right to be here. And whether or not it is clear to you, no doubt the universe is unfolding as it should. Therefore be at peace with God, whatever you conceive Him to be, and whatever your labours and aspirations, in the noisy confusion of life keep peace with your soul. With all its sham, drudgery and broken dreams, it is still a beautiful world.","Max Ehrmann,",advice-for-daily-living;be-yourself;inspirational,1399
448,Jerome,M,162966,0.000445996,"Real courage is when you know you're licked before you begin, but you begin anyway and see it through no matter what.","Harper Lee,",character;courage;inspirational;moral-courage;perseverance;tenacity,1399
449,Erik,M,162301,0.000444176,"We either make ourselves miserable, or we make ourselves strong. The amount of work is the same.",Carlos Castaneda,confidence;inspirational,1379
450,Alvin,M,162184,0.000443856,The outer world is a reflection of the inner world. Other people??s perception of you is a reflection of them; your response to them is an awareness of you.,"Roy T. Bennett,",authentic-living;awareness;inspiration;inspirational;inspirational-attitude;inspirational-life;inspirational-quote;inspirational-quotes;inspire;inspiring;life;life-and-living;life-lessons;life-philosophy;life-quotes;living;perception,1734
451,Beth,F,162170,0.000443817,It's never too late to change your life for the better. You don't have to take huge steps to change your life. Making even the smallest changes to your daily routine can make a big difference to your life.,"Roy T. Bennett,",change;inspiration;inspirational;inspirational-attitude;inspirational-life;inspirational-quotes;inspire;inspiring;life;life-and-living;life-lessons;life-quotes;living;motivation;motivational;optimism;optimistic;positive;positive-affirmation;positive-life;positive-thinking,1713
452,Jenna,F,162031,0.000443437,We meet no ordinary people in our lives.,C.S. Lewis; Inspirational Christian Library,inspirational,1453
453,Yvonne,F,161975,0.000443284,Strong people have a strong sense of self-worth and self-awareness; they don??t need the approval of others.,"Roy T. Bennett,",inspiration;inspirational;inspirational-attitude;inspirational-life;inspirational-quotes;inspire;inspiring;life;life-and-living;life-lessons;life-quotes;living;motivation;motivational;optimism;optimistic;positive;positive-affirmation;positive-life;positive-thinking;self-awareness;self-worth;strong,1453
454,Rosemary,F,161743,0.000442649,Music melts all the separate parts of our bodies together.,Anais Nin,inspirational,1405
455,Landon,M,161513,0.000442019,There are two ways to reach me: by way of kisses or by way of the imagination. But there is a hierarchy: the kisses alone don't work.,"Ana??s Nin,",inspirational,1391
456,Bill,M,161119,0.000440941,"Too often we underestimate the power of a touch, a smile, a kind word, a listening ear, an honest compliment, or the smallest act of caring, all of which have the potential to turn a life around.",Leo Buscaglia,compassion;empathy;inspirational;listening,1391
457,Haley,F,160950,0.000440478,"Those who do not weep, do not see.","Victor Hugo,",crying;inspirational;sorrow,1383
458,Alma,F,160889,0.000440311,"People have to forgive. We don't have to like them, we don't have to be friends with them, we don't have to send them hearts in text messages, but we have to forgive them, to overlook, to forget. Because if we don't we are tying rocks to our feet, too much for our wings to carry!",C. JoyBell C.,flying;forgive;forgiveness;forgiving;inspirational;inspirational-attitude;inspirational-life;inspirational-quotes;inspiring;life;life-and-living;living;living-life;tying-rocks-to-our-feet;wings;wisdom-quotes,1375
459,Wyatt,M,160882,0.000440292,"Stop giving other people the power to control your happiness, your mind, and your life. If you don't take control of yourself and your own life, someone else is bound to try.","Roy T. Bennett,",happiness;inspiration;inspirational;inspirational-attitude;inspirational-life;inspirational-quotes;inspire;inspiring;life;life-and-living;life-lessons;life-quotes;living;mind;motivation;motivational;optimism;optimistic;positive;positive-affirmation;positive-life;positive-thinking,1374
460,Micheal,M,160821,0.000440125,Nothing great was ever achieved without enthusiasm.,Ralph Waldo Emerson,inspirational,1365
461,Agnes,F,159642,0.000436899,"Be more concerned with your character than your reputation, because your character is what you really are, while your reputation is merely what others think you are.",John Wooden,advice-for-daily-living;character;inspirational;self-image,1361
462,Gina,F,159142,0.00043553,I'd rather learn from one bird how to sin,E.E. Cummings,constructive-living;inspirational,1360
463,Minnie,F,159031,0.000435227,"At the end of the day, let there be no excuses, no explanations, no regrets.","Steve Maraboli,",appreciation;excuses;gratitude;inspirational;life;motivational;no-regrets;seize-the-day;success,1359
464,Sebastian,M,159006,0.000435158,Always dream and shoot higher than you know you can do. Do not bother just to be better than your contemporaries or predecessors. Try to be better than yourself.,William Faulkner,inspirational;perfectionism;personality;potential;self-improvement,1357
465,Devin,M,158785,0.000434553,I believe there is another world waiting for us. A better world. And I'll be waiting for you there.,"David Mitchell,",cloud-atlas;inspirational;inspirational-quotes;life;science,1352
466,Georgia,F,158413,0.000433535,"There's so much to be grateful for, words are poor things.","Marilynne Robinson,",faith;inspirational,1337
467,Stacey,F,158129,0.000432758,"I shall look at you out of the corner of my eye, and you will say nothing. Words are the source of misunderstandings.",Antoine de Saint-Exup??ry,communication;inspirational;philosophy,1328
468,Pearl,F,158052,0.000432547,Dream as if you will live forever; Live as if you will die today.,James  Dean,advice-for-daily-living;aspirations;carpe-diem;inspirational,1325
469,Vicki,F,158035,0.000432501,"Just be yourself, there is no one better.",Taylor Swift,be-yourself;inspirational,1320
470,Joann,F,157448,0.000430894,There is a way to be good again...,"Khaled Hosseini,",inspirational,1320
471,Max,M,157249,0.00043035,If your feet are firmly planted on the ground you'll never be able to dance.,"Iris Johansen,",inspirational,1313
472,Kelsey,F,156489,0.00042827,"We all make mistakes, have struggles, and even regret things in our past. But you are not your mistakes, you are not your struggles, and you are here NOW with the power to shape your day and your future.","Steve Maraboli,",inspirational;life;living-now;mistakes;motivational;regret;self-empowerment;struggles,1313
473,Lillie,F,156312,0.000427785,"What are you going to do with your life?"" In one way or another it seemed that people had been asking her this forever; teachers, her parents, friends at three in the morning, but the question had never seemed this pressing and still she was no nearer an answer... ""Live each day as if it's your last', that was the conventional advice, but really, who had the energy for that? What if it rained or you felt a bit glandy? It just wasn't practical. Better by far to be good and courageous and bold and to make difference. Not change the world exactly, but the bit around you. Cherish your friends, stay true to your principles, live passionately and fully and well. Experience new things. Love and be loved, if you ever get the chance.","David Nicholls,",inspirational,1312
474,Levi,M,155345,0.000425139,"Once we accept our limits, we go beyond them.",Albert Einstein,inspirational;self-improvement;self-knowledge,1310
475,Lily,F,154954,0.000424069,Every man is a damn fool for at least five minutes every day; wisdom consists in not exceeding the limit.,"Elbert Hubbard,",foolishness;inspirational,1304
476,Floyd,M,154927,0.000423995,Without fear there cannot be courage.,Christopher Paolini,bravery;courage;fear;inspirational,1300
477,Carla,F,154549,0.000422961,"Scar tissue is stronger than regular tissue. Realize the strength, move on.",Henry Rollins,inspirational;life,1298
478,Edgar,M,154500,0.000422826,"If you have a strong purpose in life, you don't have to be pushed. Your passion will drive you there.","Roy T. Bennett,",inspirational;inspirational-attitude;inspirational-life;inspirational-quotes;inspire;inspiring;leadership;life;life-and-living;life-lessons;life-quotes;living;motivation;motivational;optimism;optimistic;passion;positive;positive-affirmation;positive-life;positive-thinking;purpose,1290
479,Lewis,M,154072,0.000421655,"But if I'm it, the last of my kind, the last page of human history, like hell I'm going to let the story end this way. I may be the last one, but I am the one still standing. I am the one turning to face the faceless hunter in the woods on an abandoned highway. I am the one not running but facing. Because if I am the last one, then I am humanity. And if this is humanity's last war, then I am the battlefield.","Rick Yancey,",cassie;human;humanity;inspirational;powerful;survivor,1259
480,Jim,M,153801,0.000420913,"Focus on your strengths, not your weaknesses","Roy T. Bennett,",authentic-living;being-positive;blessing;blessings;character;focus;inspiration;inspirational;inspirational-quotes;life;life-quotes;motivation;optimism;optimistic;positive;positive-affirmation;positive-life;positive-thinking;reputation;strength;weakness,1626
481,Nora,F,153639,0.00042047,"When in a relationship, a real man doesn't make his woman jealous of others, he makes others jealous of his woman.","Steve Maraboli,",boyfriend;girlfriend;inspirational;jealous;life;love;marriage;men;motivational;relationship;women,1509
482,Maureen,F,152294,0.000416789,Never stop dreaming,"Roy T. Bennett,",believe;inspiration;inspirational;inspirational-attitude;inspirational-life;inspirational-quotes;inspire;inspiring;learning;life;life-and-living;life-lessons;life-quotes;living;motivation;motivational;never-give-up;never-stop-believing;never-stop-dreaming;never-stop-learning;never-stop-trying;optimism;optimistic;positive;positive-affirmation;positive-life;positive-thinking;success,1488
483,Brent,M,152033,0.000416075,"For like a shaft, clear and cold, the thought pierced him that in the end the Shadow was only a small and passing thing: there was light and high beauty for ever beyond its reach.","J.R.R. Tolkien,",hope;inspirational,1468
484,Heidi,F,151914,0.000415749,"It is always the false that makes you suffer, the false desires and fears, the false values and ideas, the false relationships between people. Abandon the false and you are free of pain; truth makes happy, truth liberates.",Sri Nisargadatta Maharaj,inspirational;spiritual;truth,1356
485,Derrick,M,151297,0.000414061,"When each day is the same as the next, it??s because people fail to recognize the good things that happen in their lives every day that the sun rises.","Paulo Coelho,",inspirational,1307
486,Mario,M,151205,0.000413809,My heart is warm with the friends I make,"Edna St. Vincent Millay,",friends;inspirational;train,1286
487,Nellie,F,150289,0.000411302,Those who look for the bad in people will surely find it.,Abraham Lincoln,inspirational,1276
488,Lindsay,F,150081,0.000410733,Fiction is art and art is the triumph over chaos?? to celebrate a world that lies spread out around us like a bewildering and stupendous dream.,John Cheever,books;fiction;inspirational;on-fiction;writing,1270
489,Kristina,F,149828,0.00041004,I dreamed I spoke in another's language,"Clive Barker,",inspirational;love;poetry,1265
490,Shelby,F,149560,0.000409307,"What would come, would come...and you would have to meet it, when it did.","J.K. Rowling,",inspirational;life;que-sera-sera,1265
491,Terri,F,148793,0.000407208,I'd rather be a rising ape than a falling angel.,Terry Pratchett,humour;inspirational,1255
492,Destiny,F,148447,0.000406261,Resentment is like drinking poison and then hoping it will kill your enemies.,Nelson Mandela,forgiveness;inspirational,1250
493,Vernon,M,148317,0.000405905,"I learned this, at least, by my experiment; that if one advances confidently in the direction of his dreams, and endeavors to live the life which he has imagined, he will meet with a success unexpected in common hours..","Thoreau, Henry David",confidence;dreams;inspirational;life,1249
494,Paige,F,146805,0.000401767,"Amateurs sit and wait for inspiration, the rest of us just get up and go to work.","Stephen King,",inspirational;productivity;writing,1243
